{
  "schema": "urn:aihq:harness:tool-binding:1.0.0",
  "tool": "claude",
  "digest": "de359479a27855c138e0b0d7750e44214287ab531b9df9b8634972dacb6d3165",
  "layouts": {
    "skill": {
      "support": "native",
      "reason": "Recognised: the model used the full skill body.",
      "observations": [
        {
          "toolVersion": "2.1.308",
          "observedAt": "2026-10-23T18:25:50.241Z",
          "coreVersion": "1.0.0-dev.37",
          "os": "windows",
          "arch": "x64",
          "isolation": "env-redirect-outside-profile",
          "runRecordDigest": "2ed5e37e60e5cc8ddcb4b47ba69ca90db828ac8a12c1868bbfc7b3bfbbdbe039",
          "delivered": "delivered",
          "registered": "inconclusive",
          "recognised": "recognised"
        }
      ],
      "roots": {
        "project": ".claude/skills"
      }
    },
    "agent": {
      "support": "native",
      "reason": "Listed only: the model saw the agent but no use was observed.",
      "observations": [
        {
          "toolVersion": "2.1.308",
          "observedAt": "2026-10-23T18:25:50.241Z",
          "coreVersion": "1.0.0-dev.37",
          "os": "windows",
          "arch": "x64",
          "isolation": "env-redirect-outside-profile",
          "runRecordDigest": "2ed5e37e60e5cc8ddcb4b47ba69ca90db828ac8a12c1868bbfc7b3bfbbdbe039",
          "delivered": "delivered",
          "registered": "inconclusive",
          "recognised": "listed-only"
        }
      ],
      "roots": {
        "project": ".claude/agents"
      }
    },
    "command": {
      "support": "native",
      "reason": "Recognised: the command ran.",
      "observations": [
        {
          "toolVersion": "2.1.308",
          "observedAt": "2026-10-23T18:25:50.241Z",
          "coreVersion": "1.0.0-dev.37",
          "os": "windows",
          "arch": "x64",
          "isolation": "env-redirect-outside-profile",
          "runRecordDigest": "2ed5e37e60e5cc8ddcb4b47ba69ca90db828ac8a12c1868bbfc7b3bfbbdbe039",
          "delivered": "delivered",
          "registered": "inconclusive",
          "recognised": "recognised"
        }
      ],
      "roots": {
        "project": ".claude/commands"
      }
    },
    "rule": {
      "support": "native",
      "reason": "Recognised: the model used the rule.",
      "observations": [
        {
          "toolVersion": "2.1.308",
          "observedAt": "2026-10-23T18:25:50.241Z",
          "coreVersion": "1.0.0-dev.37",
          "os": "windows",
          "arch": "x64",
          "isolation": "env-redirect-outside-profile",
          "runRecordDigest": "2ed5e37e60e5cc8ddcb4b47ba69ca90db828ac8a12c1868bbfc7b3bfbbdbe039",
          "delivered": "delivered",
          "registered": "not-checked",
          "recognised": "recognised"
        }
      ],
      "roots": {
        "project": ".claude/rules"
      }
    },
    "hook": {
      "support": "native",
      "reason": "Recognised: the hook fired and its output reached the model.",
      "observations": [
        {
          "toolVersion": "2.1.308",
          "observedAt": "2026-10-23T18:25:50.241Z",
          "coreVersion": "1.0.0-dev.37",
          "os": "windows",
          "arch": "x64",
          "isolation": "env-redirect-outside-profile",
          "runRecordDigest": "2ed5e37e60e5cc8ddcb4b47ba69ca90db828ac8a12c1868bbfc7b3bfbbdbe039",
          "delivered": "delivered",
          "registered": "not-checked",
          "recognised": "recognised"
        }
      ],
      "roots": {
        "project": ".claude/hooks"
      },
      "register": {
        "file": ".claude/settings.json",
        "container": [
          "hooks",
          "SessionStart"
        ],
        "format": "json",
        "approval": "none"
      },
      "hookEvents": {
        "SessionStart": "SessionStart"
      },
      "hookProtocols": [
        "claude-code-hooks"
      ]
    },
    "mcp-server": {
      "support": "native",
      "reason": "Registered; the server waits for approval before a call.",
      "observations": [
        {
          "toolVersion": "2.1.308",
          "observedAt": "2026-10-23T18:25:50.241Z",
          "coreVersion": "1.0.0-dev.37",
          "os": "windows",
          "arch": "x64",
          "isolation": "env-redirect-outside-profile",
          "runRecordDigest": "2ed5e37e60e5cc8ddcb4b47ba69ca90db828ac8a12c1868bbfc7b3bfbbdbe039",
          "delivered": "delivered",
          "registered": "registered-pending-approval",
          "recognised": "listed-only"
        }
      ],
      "roots": {
        "project": ".mcp.json"
      },
      "register": {
        "file": ".mcp.json",
        "container": [
          "mcpServers"
        ],
        "format": "json",
        "approval": "per-project",
        "permissionStep": "Approve the project MCP server in Claude Code."
      }
    },
    "document": {
      "support": "native",
      "reason": "Delivered beside the item that requires it.",
      "observations": [
        {
          "toolVersion": "2.1.308",
          "observedAt": "2026-10-23T18:25:50.241Z",
          "coreVersion": "1.0.0-dev.37",
          "os": "windows",
          "arch": "x64",
          "isolation": "env-redirect-outside-profile",
          "runRecordDigest": "2ed5e37e60e5cc8ddcb4b47ba69ca90db828ac8a12c1868bbfc7b3bfbbdbe039",
          "delivered": "delivered",
          "registered": "not-checked",
          "recognised": "not-run"
        }
      ],
      "roots": {}
    }
  },
  "entryFiles": [],
  "alsoReads": []
}
