{
  "schema": "urn:aihq:harness:tool-binding:1.0.0",
  "tool": "claude",
  "digest": "a457a03c1ce03b7790beb92ed0e0d9f0e3a1f0e96c174ef580ab23220f98c7d8",
  "layouts": {
    "skill": {
      "support": "native",
      "reason": "Recognised: the model used the full skill body.",
      "observations": [
        {
          "toolVersion": "2.1.308",
          "observedAt": "2026-10-23T18:25:50.241Z",
          "coreVersion": "1.0.0-dev.37",
          "os": "windows",
          "arch": "x64",
          "isolation": "env-redirect-outside-profile",
          "runRecordDigest": "a41964b3c7f45b63f12bbdb52929cd04ab794cf0e84573f523630ae29deffeb6",
          "delivered": "delivered",
          "registered": "not-checked",
          "recognised": "recognised"
        },
        {
          "toolVersion": "2.1.308",
          "observedAt": "2026-10-23T06:22:20.527Z",
          "coreVersion": "1.0.0-dev.37",
          "os": "windows",
          "arch": "x64",
          "isolation": "env-redirect-inside-profile",
          "runRecordDigest": "a41964b3c7f45b63f12bbdb52929cd04ab794cf0e84573f523630ae29deffeb6",
          "delivered": "delivered",
          "registered": "inconclusive",
          "recognised": "not-run"
        }
      ],
      "roots": {
        "project": ".claude/skills"
      }
    },
    "agent": {
      "support": "unconfirmed",
      "reason": "Listed only: the model saw the agent but no use was observed.",
      "observations": [
        {
          "toolVersion": "2.1.308",
          "observedAt": "2026-10-23T18:25:50.241Z",
          "coreVersion": "1.0.0-dev.37",
          "os": "windows",
          "arch": "x64",
          "isolation": "env-redirect-outside-profile",
          "runRecordDigest": "a41964b3c7f45b63f12bbdb52929cd04ab794cf0e84573f523630ae29deffeb6",
          "delivered": "delivered",
          "registered": "not-checked",
          "recognised": "listed-only"
        },
        {
          "toolVersion": "2.1.308",
          "observedAt": "2026-10-23T06:22:29.878Z",
          "coreVersion": "1.0.0-dev.37",
          "os": "windows",
          "arch": "x64",
          "isolation": "env-redirect-inside-profile",
          "runRecordDigest": "a41964b3c7f45b63f12bbdb52929cd04ab794cf0e84573f523630ae29deffeb6",
          "delivered": "delivered",
          "registered": "inconclusive",
          "recognised": "not-run"
        }
      ],
      "roots": {
        "project": ".claude/agents"
      }
    },
    "command": {
      "support": "native",
      "reason": "Recognised: the command ran.",
      "observations": [
        {
          "toolVersion": "2.1.308",
          "observedAt": "2026-10-23T18:25:50.241Z",
          "coreVersion": "1.0.0-dev.37",
          "os": "windows",
          "arch": "x64",
          "isolation": "env-redirect-outside-profile",
          "runRecordDigest": "a41964b3c7f45b63f12bbdb52929cd04ab794cf0e84573f523630ae29deffeb6",
          "delivered": "delivered",
          "registered": "not-checked",
          "recognised": "recognised"
        },
        {
          "toolVersion": "2.1.308",
          "observedAt": "2026-10-23T06:22:27.171Z",
          "coreVersion": "1.0.0-dev.37",
          "os": "windows",
          "arch": "x64",
          "isolation": "env-redirect-inside-profile",
          "runRecordDigest": "a41964b3c7f45b63f12bbdb52929cd04ab794cf0e84573f523630ae29deffeb6",
          "delivered": "delivered",
          "registered": "inconclusive",
          "recognised": "not-run"
        }
      ],
      "roots": {
        "project": ".claude/commands"
      }
    },
    "rule": {
      "support": "native",
      "reason": "Recognised: the model used the rule.",
      "observations": [
        {
          "toolVersion": "2.1.308",
          "observedAt": "2026-10-23T18:25:50.241Z",
          "coreVersion": "1.0.0-dev.37",
          "os": "windows",
          "arch": "x64",
          "isolation": "env-redirect-outside-profile",
          "runRecordDigest": "a41964b3c7f45b63f12bbdb52929cd04ab794cf0e84573f523630ae29deffeb6",
          "delivered": "delivered",
          "registered": "not-checked",
          "recognised": "recognised"
        }
      ],
      "roots": {
        "project": ".claude/rules"
      }
    },
    "hook": {
      "support": "native",
      "reason": "Recognised: the hook fired and its output reached the model.",
      "observations": [
        {
          "toolVersion": "2.1.308",
          "observedAt": "2026-10-23T18:25:50.241Z",
          "coreVersion": "1.0.0-dev.37",
          "os": "windows",
          "arch": "x64",
          "isolation": "env-redirect-outside-profile",
          "runRecordDigest": "a41964b3c7f45b63f12bbdb52929cd04ab794cf0e84573f523630ae29deffeb6",
          "delivered": "delivered",
          "registered": "not-checked",
          "recognised": "recognised"
        },
        {
          "toolVersion": "2.1.312",
          "observedAt": "2026-10-29T10:43:30.408Z",
          "coreVersion": "1.0.0-dev.38",
          "os": "windows",
          "arch": "x64",
          "isolation": "env-redirect-outside-profile",
          "runRecordDigest": "75d1ddb142ccd82723818f798f4b7e2b0b3570ab4d077d96fda24bc613191ae6",
          "delivered": "delivered",
          "registered": "not-checked",
          "recognised": "recognised"
        },
        {
          "toolVersion": "2.1.312",
          "observedAt": "2026-10-29T14:47:25.911Z",
          "coreVersion": "1.0.0-dev.40",
          "os": "windows",
          "arch": "x64",
          "isolation": "env-redirect-outside-profile",
          "runRecordDigest": "db0b16f01229c30c3a13d322e3a97537cb78b52bf5d562df5e79529be506a273",
          "delivered": "delivered",
          "registered": "registered",
          "recognised": "recognised"
        }
      ],
      "roots": {
        "project": ".claude/hooks"
      },
      "register": {
        "file": ".claude/settings.json",
        "container": [
          "hooks",
          "SessionStart"
        ],
        "format": "json",
        "approval": "none"
      },
      "hookEvents": {
        "SessionStart": "SessionStart",
        "PreToolUse": "PreToolUse",
        "PostToolUse": "PostToolUse",
        "PostToolUseFailure": "PostToolUseFailure",
        "PreCompact": "PreCompact",
        "Stop": "Stop",
        "SessionEnd": "SessionEnd"
      },
      "hookProtocols": [
        "claude-code-hooks"
      ],
      "commandTemplate": "CLAUDE_PLUGIN_ROOT=\"{pluginRoot}\" {command}"
    },
    "mcp-server": {
      "support": "native",
      "reason": "Registered; the server waits for approval before a call.",
      "observations": [
        {
          "toolVersion": "2.1.308",
          "observedAt": "2026-10-23T18:25:50.241Z",
          "coreVersion": "1.0.0-dev.37",
          "os": "windows",
          "arch": "x64",
          "isolation": "env-redirect-outside-profile",
          "runRecordDigest": "a41964b3c7f45b63f12bbdb52929cd04ab794cf0e84573f523630ae29deffeb6",
          "delivered": "delivered",
          "registered": "registered-pending-approval",
          "recognised": "listed-only"
        },
        {
          "toolVersion": "2.1.308",
          "observedAt": "2026-10-23T06:22:35.855Z",
          "coreVersion": "1.0.0-dev.37",
          "os": "windows",
          "arch": "x64",
          "isolation": "env-redirect-inside-profile",
          "runRecordDigest": "a41964b3c7f45b63f12bbdb52929cd04ab794cf0e84573f523630ae29deffeb6",
          "delivered": "delivered",
          "registered": "registered-pending-approval",
          "recognised": "not-run"
        }
      ],
      "roots": {
        "project": ".mcp.json"
      },
      "register": {
        "file": ".mcp.json",
        "container": [
          "mcpServers"
        ],
        "format": "json",
        "approval": "per-project",
        "permissionStep": "Approve the project MCP server in Claude Code.",
        "approvalLocation": {
          "shape": "array",
          "file": ".claude/settings.local.json",
          "format": "json",
          "container": [
            "enabledMcpjsonServers"
          ],
          "denied": [
            "disabledMcpjsonServers"
          ]
        }
      }
    },
    "document": {
      "support": "native",
      "reason": "Delivered beside the item that requires it.",
      "observations": [
        {
          "toolVersion": "2.1.308",
          "observedAt": "2026-10-23T18:25:50.241Z",
          "coreVersion": "1.0.0-dev.37",
          "os": "windows",
          "arch": "x64",
          "isolation": "env-redirect-outside-profile",
          "runRecordDigest": "a41964b3c7f45b63f12bbdb52929cd04ab794cf0e84573f523630ae29deffeb6",
          "delivered": "delivered",
          "registered": "not-checked",
          "recognised": "not-run"
        }
      ],
      "roots": {}
    }
  },
  "entryFiles": [
    "CLAUDE.md"
  ],
  "entryPointer": {
    "file": "CLAUDE.md",
    "template": "@AGENTS.md"
  },
  "alsoReads": []
}
